{
  "$schema": "https://json-schema.org/draft/2020-12/schema",
  "$id": "https://schemas.zovark.io/v1/update_candidate.schema.json",
  "title": "Zovark Update Candidate",
  "description": "An improvement candidate produced by the Research Pipeline (or human author) and submitted to the Update Factory promotion queue.",
  "type": "object",
  "additionalProperties": false,
  "x-zovark-license": "Apache-2.0",
  "x-zovark-open-source": true,
  "x-zovark-publication": "source-available-with-product",
  "x-zovark-schema-version": "1.0.0",
  "x-zovark-compatibility": ">=v3.2.4.2",
  "x-zovark-standards-attribution": [
    {"standard": "Zovark", "role": "canonical"}
  ],
  "required": [
    "candidate_id",
    "feature_id",
    "proposed_risk_tier",
    "source_commit",
    "generated_by",
    "generated_at",
    "proposed_change_summary",
    "affected_paths",
    "requires_security_review",
    "corpus_evidence"
  ],
  "properties": {
    "candidate_id": {
      "type": "string",
      "pattern": "^ZVK-CAND-[0-9]{4}-[0-9]{6}$",
      "description": "Globally unique candidate identifier."
    },
    "feature_id": {
      "type": "string",
      "pattern": "^F-[0-9]{3}$",
      "description": "Feature this candidate belongs to. Must exist in feature-registry.yaml."
    },
    "proposed_risk_tier": {
      "type": "integer",
      "enum": [1, 2, 3],
      "description": "Self-proposed tier per ADR-0040 §10. Promotion gate may escalate, never auto-downgrade."
    },
    "source_commit": {
      "type": "string",
      "pattern": "^[0-9a-f]{40}$",
      "description": "Source commit this candidate was generated against (full 40-char SHA)."
    },
    "generated_by": {
      "type": "string",
      "enum": ["research-pipeline", "human"],
      "description": "Origin of the candidate. Research Pipeline candidates require corpus_evidence."
    },
    "generated_at": {
      "type": "string",
      "format": "date-time",
      "description": "RFC 3339 timestamp of generation."
    },
    "proposed_change_summary": {
      "type": "string",
      "minLength": 10,
      "maxLength": 4096,
      "description": "Human-readable summary of the proposed change."
    },
    "affected_paths": {
      "type": "array",
      "minItems": 1,
      "items": {
        "type": "string",
        "minLength": 1
      },
      "description": "Repository-relative paths the candidate would modify. Used by tier-escalation logic."
    },
    "requires_security_review": {
      "type": "boolean",
      "description": "True if any affected_path matches the protected-paths set in ADR-0040 §10.1."
    },
    "corpus_evidence": {
      "type": "array",
      "items": {
        "type": "string",
        "pattern": "^[a-z0-9-]+:[0-9a-f]{8,}$"
      },
      "description": "Corpus IDs the candidate passed against. Required for research-pipeline-generated candidates; may be empty for human-generated."
    },
    "rationale": {
      "type": "string",
      "maxLength": 8192,
      "description": "Optional longer rationale. Required for Tier 3 candidates."
    }
  },
  "if": {
    "properties": {"generated_by": {"const": "research-pipeline"}}
  },
  "then": {
    "properties": {
      "corpus_evidence": {"minItems": 1}
    }
  }
}
